question_id,question,assumption_id,assumption,veracity
reddit.4.42,Are visual hallucinations a normal pregnancy symptom?,reddit.4.42.3,Visual hallucinations during pregnancy may not be dangerous.,false_unsure
rosie.4.27,When should I start looking for a Pediatrician?,rosie.4.27.2,I should wait until after my baby is born to find a pediatrician.,false_unsure
reddit.2.2,Is it important to use the slow flow nipple in the feeding bottle at all times or should I switch to the faster flow nipple for my 4 month old?,reddit.2.2.0,Babies can handle faster milk flows as they grow.,false_unsure
nq.2.8,what does code pink mean in labor and delivery,nq.2.8.2,There is no specific code for when a baby is abducted.,false_unsure
reddit.4.13,Is it possible to continue lactating indefinitely?,reddit.4.13.4,Some breast milk may be beneficial for young children after the infant stage.,true
reddit.2.28,How can I prepare for successful breastfeeding with my second child?,reddit.2.28.2,Expressing colostrum at the end of pregnancy can help start breastfeeding after delivery.,true
rosie.3.21,When should my baby start holding her own bottle ?,rosie.3.21.2,There may be a potential delay in future developmental milestones if the baby does not hold their own bottle.,false_unsure
reddit.1.5,What is the best way to keep a newborn warm on very cold winter walks?,reddit.1.5.3,There are different fabrics and types of clothing that can be used to keep a baby warm during a winter walk.,true
nq.2.16,what hormone keeps the lining thick once the ovum has been released,nq.2.16.1,Taking estrogen pills can help keep the ovum healthy for the implanting pregnancy.,false_unsure
reddit.2.22,Will stress during pregnancy harm my baby?,reddit.2.22.2,There are some anti-anxiety/depression medications that are safe to take during pregnancy.,true
reddit.2.47,When can I start building a stash of pumped breast milk?,reddit.2.47.1,I need to start early to prepare a stash of extra breastmilk for when I go back to work.,true
nq.2.44,when do babies start to have stranger anxiety,nq.2.44.0,Stranger anxiety starts at a certain point in a baby's development.,true
rosie.3.42,Is better that my baby uses a pacifier or fingers?,rosie.3.42.0,Babies have a natural need to suck on objects.,true
reddit.1.49,Can you diet while nursing?,reddit.1.49.2,Breastfeeding may aid in weight loss.,true
reddit.4.31,How much water should I drink to increase my milk supply?,reddit.4.31.2,There is a certain amount of water necessary to increase milk supply.,false_unsure
nq.2.10,what are the chances of a baby surviving a tubal pregnancy,nq.2.10.1,It is possible for a pregnancy to successfully implant and grow in the fallopian tube.,false_unsure
rosie.4.19,How often do babies feet grow?,rosie.4.19.1,There is a general pattern or timeframe for how often a baby's feet will grow during the first year.,false_unsure
rosie.2.32,How do I know if my baby is moving enough?,rosie.2.32.1,There is a standard amount that my baby should be moving.,true
reddit.3.0,Should I get the whooping cough vaccine while pregnant?,reddit.3.0.1,The whooping cough vaccine may pose a risk to the fetus.,false_unsure
nq.2.26,what stimulates the corpus luteum to produce progesterone,nq.2.26.3,The corpus luteum is necessary for maintaining a pregnancy.,false_unsure
rosie.4.7,What is a good way for my child to express feelings?,rosie.4.7.2,Expressing feelings is not limited to verbal communication.,true
reddit.2.3,When should I give my baby fever reducing meds after shots?,reddit.2.3.3,Receiving shots can cause a fever in a baby.,true
reddit.2.35,Is it safe for my 10 week old to sleep through the night?,reddit.2.35.4,There may be potential negative consequences if a 10-week-old baby skips their night feedings.,false_unsure
rosie.4.31,Is it normal for baby to move more than usual when closer to due date?,rosie.4.31.12,"The positioning of the placenta can affect fetal movement, especially as the due date approaches.",false_unsure
reddit.2.48,Are prenatal vitamins optional or necessary?,reddit.2.48.4,"If morning sickness doesn't last long, there may not be any negative consequences from not taking a prenatal vitamin.",false_unsure
rosie.4.17,How do I know when I lose mucus plug ?,rosie.4.17.5,There will be a sign or symptom that is noticeable when the mucus plug is lost.,false_unsure
nq.2.7,where does the gestation of the fetus occur,nq.2.7.2,"There are cases where gestation can occur in other anatomical locations, such as the fallopian tubes or outside of the uterus.",true
rosie.4.21,Can I give my 6 month old food?,rosie.4.21.5,There are specific nutritional requirements for a 6-month-old.,false_unsure
nq.2.10,what are the chances of a baby surviving a tubal pregnancy,nq.2.10.3,Babies cannot grow to full term in the fallopian tube.,true
reddit.1.7,Is it possible to be diagnosed with PPD at 12 weeks postpartum?,reddit.1.7.1,PPD is more likely to occur during the first few months after delivery.,true
rosie.3.38,When should I stop breast feeding?,rosie.3.38.3,Breastfeeding for too long could cause physical or psychological problems for my child.,false_unsure
nq.2.25,which hormone causes follicles to release their eggs for fertilization,nq.2.25.3,One of the hormones is responsible for follicular growth.,false_unsure
rosie.3.4,How many hours should a baby sleep?,rosie.3.4.0,Babies need a lot of sleep.,true
nq.2.48,when might fundal height in a pregnant woman most accurately predict gestational age,nq.2.48.3,Fundal height can be used to predict gestational age throughout the entire pregnancy.,false_unsure
reddit.1.21,Will my 5-month-old baby get COVID if I have it while breastfeeding?,reddit.1.21.1,There is a risk of your baby contracting COVID while breastfeeding through other means such as coughing or sneezing.,true
rosie.3.6,When is it time to push?,rosie.3.6.0,Pushing is necessary for the baby to come out.,false_unsure
rosie.3.25,Which kind of food to avoid during breastfeeding?,rosie.3.25.0,There are foods or nutrients that can cross into breast milk.,true
nq.2.3,where does implantation and formation of the placenta normally occur,nq.2.3.3,Pregnancies can attach to specific places in the uterus.,true
reddit.2.28,How can I prepare for successful breastfeeding with my second child?,reddit.2.28.1,Breastfeeding may be harder the second time.,false_unsure
rosie.3.39,When should I transition from formula to baby food?,rosie.3.39.0,There may not be a uniform best time to transition from formula to baby food.,false_unsure
